a_title,b_digest,c_link,d_ts
杭州电信5G助力智能网联公交车,日前，由中国电信浙江杭州分公司合作实施的杭州市萧山区5G智能网联车路协同系统项目亮相。该项目基于5G通信和网联自动驾驶技术，实现车路协同、智慧路口、绿波引导、智能巡航、车车互通、智慧站台等应用，为全国首个在社会开放路段实施并面向商业应用的车路协同项目。据悉，项目一期覆盖7公里路段，涉及7个路口、2个,http://www.c114.com.cn/news/111/a1111599.html,2019/12/16 09:25
欧洲目前超过20个国家或地区选择华为5G设备,近日Michael统计了选择华为5G设备的欧洲国家，信息显示目前数量已经达到21个国家或地区，该信息也得到华为欧洲的确认。信息显示，目前明确表示选择华为5G设备的国家或地区有英国、法国、德国、挪威、意大利、摩纳哥、西班牙、瑞士、爱尔兰、葡萄牙、荷兰、芬兰、希腊、塞浦路斯、奥地利、罗马尼亚、匈牙利、土,http://www.c114.com.cn/news/17/a1111600.html,2019/12/16 09:26
为5G商用铺路！移远通信5G开发者研讨会（深圳站）顺利举行,12月13日，移远通信5G开发者研讨会在深圳顺利举行，近200位来自运营商、物联网产业链企业的嘉宾出席了本次会议。移远5G领域的专家带来了移远在5G方面的领先成果，并详细讲述了移远5G模组在支持终端设计时的技术优势及注意事项等。在被誉为商用元年的2019年，5G的发展取得了重大的突破。运营商积极部署,http://www.c114.com.cn/wireless/2935/a1111604.html,2019/12/16 09:46
杭州电信助力长龙航空“5G+远程维修”,日前，长龙航空联合中国电信杭州分公司完成总部大楼5G信号全覆盖，成为杭州首家5G信号全覆盖的企业。5G信号全覆盖后，利用大带宽、高速率、低时延的5G网络，长龙航空将推进5G+远程维修应用。通过5G网络及布置在机检工业园区内的高清摄像头的头盔，将现场高清图像回传至专家室，从而快速解决室外、移动性场景的,http://www.c114.com.cn/news/111/a1111607.html,2019/12/16 09:51
【上周回顾】中国电信：5G终端禁CDMA制式；小米系率先将5G手机带入2000元时代；我国5G手机11月出货量超500万部,本周热点有中国电信：5G终端禁CDMA制式；小米系率先将5G手机带入2000元时代；我国5G手机11月出货量超500万；中国电信组织架构大调整；联通数据中心交换机集采预算9.3亿；美政府拍板放弃DSRC 转向C-V2X；联通在线两周年：重新定义185中国电信：5G终端禁CDMA制式近日，有网友在通信,http://www.c114.com.cn/news/16/a1111592.html,2019/12/16 08:48
R17技术演进路线明确，5G时代“中国声音”响彻3GPP,在近日于西班牙锡切斯成功召开的3GPP RAN第86次全会上，明确了备受业界关注的3GPP 5G第3个版本（Rel-17）的技术演进路线。,http://www.c114.com.cn/wireless/2935/a1111585.html,2019/12/16 07:59
苏州移动打造全省首个5G+智慧高速服务区,沪宁高速上的阳澄湖服务区在今年年中完成改造。作为国内首个以梦里水乡、诗画江南为设计理念，以苏州一街三园为特色，不断引入本地非遗文化和高科技亮点的服务区苏州阳澄湖服务区，目前已逐步被打造成全国知名的网红服务区，客流量暴增，据统计，日均客流量已达7万人次。科技赋能、创新领跑，是当前服务转型的发展理念，为,http://www.c114.com.cn/news/94/a1111613.html,2019/12/16 09:54
12月19日盛大开幕|快收下这份逛展攻略，年终5G物联网大展来了,"时间：12月19-21日地点：深圳会展中心（福田）深圳国际物联网与智慧未来展、EVAC深圳国际未来汽车及技术展将协同一年一度的ELEXCON2019深圳国际电子展,IEE深圳国际嵌入式系统展盛大开幕，并引入全球巡回盛会IoT World中国站与5G China全球大会，奉上一场助力5G以及物联网技术",http://www.c114.com.cn/expo/13/a1111623.html,2019/12/16 10:34
中兴终端总裁徐锋：2020年至少推出15款5G终端,在波澜诡谲的手机市场中屹立二十多年不倒，中兴终端堪称手机届的“黄埔军校”。如今，中兴终端正依托强大的技术实力打造具有核心竞争力的5G端到端解决方案，力争在第一批5G商用的浪潮中与战略合作伙伴紧密合作，共同推动5G产业链的发展，加速5G的商用进程，以“5G先锋”的身份回归主流手机品牌队列。,http://www.c114.com.cn/news/127/a1111624.html,2019/12/16 10:50
广东联通和广东电信开通国内首个5G SA共建共享商用站点,昨日晚间据中国联通消息，广东联通和广东电信开通国内首个5G SA共建共享商用站点。官方称在联通电信共建共享5G精品网分区建设城市广州和深圳，广东联通和广东电信在各自承建区域内同步开通了5G SA共建共享商用站点，并成功完成相关业务互操作测试，双方用户体验均符合预期，为后续SA共建共享大规模商用迈出了,http://www.c114.com.cn/news/84/a1111568.html,2019/12/15 16:58
"2000元再刷价格新低 全球智能手机5G""换机潮""来了？",随着运营商5G基站建设的迅速推进，5G手机成为手机市场最大的关注点。进入12月，各大手机品牌企业不断推出新的5G手机，5G手机的价格也不断创新低。5G手机对天线、摄像头、连接器、芯片等都提出了更新的要求，目前，手机产业链上相关上市公司纷纷扩产应对。5G商用时代到来，利好消息近期带动了5G、华为等概念,http://www.c114.com.cn/news/51/a1111643.html,2019/12/16 11:43
中兴通讯亮相第八届全球物联网峰会 5G+AIoT赋能智能制造,近日，由上海市经济和信息化委员会、中国信息通信研究院指导，上海市物联网行业协会、中国传感器与物联网产业联盟联合主办的第八届全球物联网峰会在上海举办。本届峰会以人工智能、5G与物联网互促发展为契机，聚焦探讨物联网产业发展。中兴通讯受邀参与此次峰会，中兴通讯IoT方案总监李溦在5G+工业物联网高峰论坛上,http://www.c114.com.cn/news/127/a1111632.html,2019/12/16 11:11
realme X50将于年前发售 支持双模5G/或配120Hz屏幕,此前，realme正式官宣旗下首款5G手机命名为realme真我X50 5G，支持SA/NSA双模5G网络，名字中的5代表这是realme推出的5G双模产品，0则表示该机是开启realme 5G元年的第一部手机。目前，官方没有透露这款手机的具体发布时间，不过根据这两天realme产品总监和网友的互动,http://www.c114.com.cn/news/51/a1111494.html,2019/12/13 13:22
我国未来6年5G总投资0.9-1.5万亿元，商用进程仍存五大挑战,今天，由中国国际经济交流中心和中国信息通信研究院联合推出的《中国5G经济报告2020》（以下简称报告）正式发布。报告预测，2020年我国5G总投资约为0.9万亿，2025年将达到1.5万亿。,http://www.c114.com.cn/wireless/2935/a1111487.html,2019/12/13 12:21
报告称5G网络产生的废热可用于市政供暖,德国能源巨头意昂集团最新发布的一份研究报告说，5G网络将大幅增加当地数据中心的耗电量，由此产生的废热可用于市政供暖。但目前德国只有19%的数据中心会利用废热，多数情况下是给自身的建筑物供暖或用于加热水。,http://www.c114.com.cn/wireless/2935/a1111501.html,2019/12/13 14:11
助力新时代高质量发展，《中国5G经济报告2020》正式发布,2019年12月13日，中国5G经济研讨会在北京中国国际经济交流中心召开。本次论坛由国经咨询有限公司主办，会议邀请了中国国际经济交流中心常务副理事长张晓强、中国信息通信研究院副院长何桂立、高通公司中国区董事长孟樸、中国通用技术集团检验检测认证事业部副总经理谢飞、中国联通5G创新中心主任冯毅、中兴通讯,http://www.c114.com.cn/wireless/2935/a1111493.html,2019/12/13 12:25
鸡肋还是刚需？智能手表能否成为5G时代新入口,2017年的华为分析师大会上，时任华为副董事长、轮值CEO徐直军的一番话让外界十分意外：我不明白有了智能手机为什么还要有智能手表。我们做的这东西未来到底有没有需求？两年多时间过去，包括智能手表在内的可穿戴设备已经成为华为消费者业务的重要组成部分。华为之外，小米于上个月推出了智能手表产品小米手表，OP,http://www.c114.com.cn/news/51/a1111502.html,2019/12/13 14:22
5G全面赋能经济并非一蹴而就：受益行业将分批次涌现,今天，由中国国际经济交流中心和中国信息通信研究院联合推出的《中国5G经济报告2020》（以下简称报告）正式发布。报告预测，2020年5G对我国直接经济总产出贡献6.3万亿，经济增值2.9万亿；间接经济总产出贡献10.6万亿，经济增值3.6万亿。,http://www.c114.com.cn/wireless/2935/a1111490.html,2019/12/13 12:24
5G时代下，运营商数据业务如何精细化运营？,移动通信技术从诞生以来飞速发展，回顾历史，每一代移动通信技术均带来了频谱效率和网络容量的成倍提升，促使新的业务类型不断涌现并持续发展。另一方面，新的应用场景需求的出现又推动着移动通讯技术的更新换代。在2G时代，语音和消息为主的电信服务，给运营商带来了巨大的利润。在3G/4G时代，移动互联网飞速发展，,http://www.c114.com.cn/wireless/2935/a1111486.html,2019/12/13 12:02
孟樸：5G“发明时代”，高通用科技赋能中国创新崛起,2019年是全球5G商用元年。为了更够更好的赋能中国创新崛起，高通与中国国际经济交流中心和中国信息通信研究院两家智库合作，推出《中国5G经济报告2020》（以下简称报告），深入探索5G如何帮助各行各业在5G之路上能有更快更好的创新。,http://www.c114.com.cn/news/1761/a1111508.html,2019/12/13 15:35
张晓强：5G赋能中国经济高质量发展，应重点关注三个方面,今日，“中国5G经济研讨会”在北京中国国际经济交流中心召开。会上，中国国际经济交流中心和中国信息通信研究院联合推出《中国5G经济报告2020》。中国国际经济交流中心常务副理事长张晓强表示，应从三方面入手推动5G高质量发展。,http://www.c114.com.cn/wireless/2935/a1111511.html,2019/12/13 15:41
realme上央视：全面拥抱5G 首款5G新机下月见,12月13日消息，realme CMO徐起在接受央视采访时表示，5G时代将会出现一些杀手级应用，比如云端游戏、更加智慧互联的IoT设备以及更高清的直播等等。realme创始人兼首席执行官李炳忠此前就表示，realme全面拥抱5G时代，2020年国内市场不再推出4G手机，全系产品将支持5G网络。,http://www.c114.com.cn/news/51/a1111514.html,2019/12/13 15:53
诺基亚将提供全球首个用于铁路运营的SA 5G系统,据外媒报道，芬兰电信设备供应商诺基亚宣布，将为从德国汉堡的关键交通枢纽Berliner Tor开始的S-Bahn 21号线长达23公里的线路铺设一张SA 5G网络。作为Digitale S-Bahn Hamburg项目的一部分，到2021年，这条线路将运营无人驾驶火车，并完全通过这张SA 5G网络共享数据。,http://www.c114.com.cn/news/116/a1111519.html,2019/12/13 16:13
中国电信“断舍离”：5G终端不允许存在CDMA制式,近日，有网友在通信人家园爆料，中国电信要求从2020年起，所有5G终端不允许存在CDMA频段和制式，同时要求不允许存在VoLTE开关；如果已报CDMA频段和制式，需要明确去除时间安排，最终入网证和型号核准证不允许出现CDMA频段和制式。,http://www.c114.com.cn/video/760/a1111525.html,2019/12/13 16:44
2019年广东联通收官重磅!5G创新中心全新亮相,12月13日，20余家国内主流媒体组成高端媒体访问团共同探访广东联通5G创新中心及参与体验无人驾驶项目，广东联通为到访媒体深入展示5G领域所取得的丰硕成果。近年来，广东联通一路向前，厚积薄发，5G发展一直走在全省乃至全国前列，不仅在5G网络建设上取得多项突破性进展，还推动多项5G创新应用的实施落地，,http://www.c114.com.cn/news/84/a1111529.html,2019/12/13 17:09
AT&T真正的5G来了！在十城启动低频5G网络商用,AT&T真正的5G网络终于启动商用。这家运营商为覆盖范围内的所有用户开通了基于低频的下一代网络，并开售销售1300美元的Galaxy Note10 Plus 5G。,http://www.c114.com.cn/news/116/a1111530.html,2019/12/13 17:11
中国电信牵头3GPP 5G网络覆盖增强立项，助推全球5G独立组网进程,当地时间2019年12月9日至12日，在西班牙锡切斯召开了3GPP RAN第86次全会，会议明确了3GPP 5G第3个版本（Rel-17）的技术演进路线。中国电信牵头的5G网络覆盖增强立项得到了全球四十多家公司的支持，并获得全会通过。5G独立组网（SA）可使能服务化架构、云化部署、云网融合、网络切片,http://www.c114.com.cn/news/117/a1111537.html,2019/12/13 19:13
Dell’oro发布2019第三季度RAN份额报告，华为5G NR蝉联全球第一,近期，全球ICT行业权威市场研究机构Dell'oro发布了2019年第三季度全球RAN份额报告《2019年第三季度移动无线接入网络市场份额报告》，该报告对各厂商RAN市场表现进行了综合评估分析。其中华为5G NR设施第三季度市场份额全面领先，蝉联全球第一。Dell'oro指出，全球5G发展持续加速甚,http://www.c114.com.cn/news/126/a1111540.html,2019/12/13 19:31
享受畅快5G网络找深圳联通 超多5G会员权益等您来拿！,随着5G商用开启，5G套餐也成为人们热议的话题，多少价位的套餐最经济适用、成为5G会员可以享受哪些权益等问题很多人并不清楚。加之各地运营商推出的5G套餐不一样，让众多想办理5G套餐的消费者望而却步。那么，同样也想尝试5G套餐的深圳联通用户，如何清楚了解并找到合适自己的套餐呢？多档5G套餐嗨不停多种会,http://www.c114.com.cn/news/84/a1111544.html,2019/12/13 21:55
华为荣获国内首家5G核心网电信设备进网许可证,近日，华为获得工业和信息化部颁发的5G核心网电信设备进网许可证。华为5G核心网支持2G/3G/4G/5G NSA/5G SA全融合，相关网元已按照进网规范一次性通过测试，符合国家规定的标准，准许接入公用电信网使用。华为作为国内首家获得5G核心网电信设备进网许可证的公司，标志着华为5G核心网设备在5G,http://www.c114.com.cn/news/126/a1111539.html,2019/12/13 19:28
中国移动推动3GPP RAN R17版本多项重要标准立项,近日，3GPP RAN第86次全会在西班牙的锡切斯（Sitges）成功召开。在本次会议上，3GPP标准专家对5G演进标准（Rel-17）进行了规划和布局，围绕网络智慧化、能力精细化、业务外延化三大方向共设立23个标准立项，涵盖面向网络智能运维的数据采集及应用增强，面向赋能垂直行业的无线切片增强、精准,http://www.c114.com.cn/news/118/a1111545.html,2019/12/14 09:22
全球第一部高功率等级5G NSA （FDD+TDD）终端3GPP研究课题日前结项,继昨天中国联通和中国电信联合牵头在3GPP成功立项2.1GHz频段50MHz带宽之后，3GPPRAN全会又传来喜报。在本次会议上，中国联通网研院牵头的国际上第一部高功率等级5G NSA终端（FDD+TDD模式）的研究课题结项。本课题研究确定了在以上模式下高功率终端如何能够满足SAR（电磁辐射吸收比）,http://www.c114.com.cn/news/119/a1111528.html,2019/12/13 17:04
德国Telefonica宣布采用华为设备建设5G网络,本周三，西班牙运营商Telefonica的德国子公司宣布选择了诺基亚和华为建设5G网络，以寻求尽快开展5G网络的部署。,http://www.c114.com.cn/video/760/a1111396.html,2019/12/12 16:14
中国首颗民营5G卫星将发射 单星覆盖面积约50个上海,记者12日从银河航天获悉，中国首颗通信能力可达10Gbps的民营5G低轨宽带卫星近日正式出厂，预计12月月底搭载快舟一号甲火箭发射升空。据了解，该卫星是中国商业航天公司银河航天自主研制的首颗Q/V频段卫星，也是中国首颗由商业航天公司研制的200公斤量级卫星，运行轨道高度为1200千米，单星可覆盖30,http://www.c114.com.cn/satellite/2515/a1111391.html,2019/12/12 15:56
台湾5G频谱拍卖已超越底价 战况不如预期激烈,本次竞拍底价总计300亿新台币（下同），规划收益440亿。暂时总得标金已超越底价，第24回合总标金为303.16亿元，最热门频段3.5GHz暂得标金299.04亿元，28GHz维持暂得标金4.12亿元，1800MHz尚无人出手。,http://www.c114.com.cn/news/106/a1111402.html,2019/12/12 16:43
思博伦在2019年获得100多个5G订单,下一代设备和网络领域领先的测试保障和分析解决方案供应商思博伦通信（伦敦证交所上市代码：SPT）今天宣布，到目前为止，2019年思博伦共获得超过100个5G相关订单。5G部署时间表不断加速，由此也推动了5G业务的高潮，而此类部署不仅需要复杂的测试，还需要在全新的下一代网络中融入新的保障技术，确保网络的,http://www.c114.com.cn/wireless/2935/a1111401.html,2019/12/12 16:41
5G来了，华为云联手开天创世探索游戏新未来,自今年6月工信部正式发布5G牌照开始，我国的5G网络建设如火如荼。就像1G时代属于语音、2G时代属于文本、3G时代属于图片、4G时代属于视频，5G最有可能将在游戏这种集语音、文本、图片和视频于一体，同时可以互动的高维信息载体上得到全面应用。游戏行业将转向内容高质量、精品化的发展阶段，这也意味着简单的,http://www.c114.com.cn/news/126/a1111399.html,2019/12/12 16:24
浙江省发布2019智慧城市成果，移动5G+智慧城市成新亮点,5G的普及正在推动智慧城市建设步入崭新阶段。12月10日在杭州举行的浙江省智慧城市2019年度高峰论坛暨成果案例发布会上，来自中国移动浙江公司的5G智慧城市新应用成为备受瞩目的亮点，其中乌镇5G示范小镇浙江移动打造乌镇5G新型智慧城镇案例获得优秀奖，5G赋能高品质步行街获得创新奖。会上还发布了浙江省,http://www.c114.com.cn/news/111/a1111405.html,2019/12/12 17:04
5G+工业互联网高峰论坛在京举行,12月10日，由中国移动通信集团有限公司(以下简称中国移动)和中国信息通信研究院联合主办的5G+工业互联网高峰论坛在京举行。工业和信息化部总经济师王新哲、中国移动赵大春副总经理出席论坛并致辞。王新哲总经济师强调，5G是新一代信息技术演进升级的重要方向，工业互联网是第四次工业革命的关键支撑。5G+工业,http://www.c114.com.cn/wireless/2935/a1111406.html,2019/12/12 17:07
中国电信“断舍离”：5G终端不允许存在CDMA制式,中国电信要求从2020年起，所有5G终端不允许存在CDMA频段和制式，同时要求不允许存在VoLTE开关；如果已报CDMA频段和制式，需要明确去除时间安排,http://www.c114.com.cn/news/117/a1111428.html,2019/12/13 07:51
中国联通发起成立“5G区块链合作伙伴计划”,2019年12月12日，中国联通在北京举办主题为链接5G、共赢未来的中国联通5G区块链研讨会。本次研讨会由可信区块链推进计划作为指导单位，中国联通网络技术研究院、中关村区块链产业联盟、金融区块链合作联盟联合主办发起。来自产学研专家共同研讨区块链赋能电信网、区块链在6G的应用以及5G区块链业务创新；分,http://www.c114.com.cn/news/119/a1111417.html,2019/12/12 20:04
鲁大师曝光三星Exynos 980跑分：中端5G芯片来了,今天硬件测试软件鲁大师发布了一款神秘机型的跑分成绩，它搭载的是三星最新的Exynos 980 5G SoC。与此同时，该款新机的硬件配置信息也浮出了水面，推测有可能是即将发布的vivo X30。根据鲁大师的数据来看，这款新机搭载了Exynos 980处理器、8GB运存，采用了一块2400x1080分,http://www.c114.com.cn/news/51/a1111445.html,2019/12/13 09:16
中国移动举办5G终端多模多频段技术讨论会,12月10日，为推动海内外5G终端支持多模多频段，特别是2.6GHz和4.9GHz等主流5G频段，中国移动联合终端产业链合作伙伴召开5G终端多模多频段技术讨论会，来自终端、芯片、器件等20余家产业合作伙伴参会。会上，中国移动研究院副院长黄宇红分享了中国移动在5G标准、规模试验、产业推进的贡献，基于2,http://www.c114.com.cn/news/118/a1111409.html,2019/12/12 18:38
日本政府推出5G减税政策,雅虎新闻12月12日消息，日本执政党于当日公布的2020年度税制改革纲要中，决定向投资5G通信网络的电信运营商提供税收优惠政策，旨在推进5G基站等相关设施的建设，以快速推广第五代（5G）移动通信系统在更广泛的领域中使用。该政策允许公司在未来两个财政年度（截至2022年3月）中，在投资额30％的特殊折,http://www.c114.com.cn/news/17/a1111447.html,2019/12/13 09:25
西班牙电信降低股息以支持5G投资计划,据Telecompaper 12月11日报道，西班牙电信德国分公司宣布在未来两年内降低股息以增加5G网络投资。预计今年资本支出为收入的13-14％，2020-2021年将达到峰值（收入的17-18％），2022年恢复到正常水平。股息从2018年的每股27美分降至今年的17美分，这是自2012年公开募,http://www.c114.com.cn/news/17/a1111451.html,2019/12/13 09:27
中国移动联手南方电网完成5G电力应急通信测试,12月12日，中国移动联合南方电网、华为公司和广东省电信规划设计院在深圳完成了5G电力应急通信测试。本次测试模拟地震、雨雪、洪水、故障抢修等灾害环境下的电力抢险救灾场景，通过应急通信车搭载5G基站进行现场支援，为现场多种大带宽多媒体装备提供大带宽回传能力，支撑现场高清视频集群通信、指挥决策。,http://www.c114.com.cn/news/118/a1111459.html,2019/12/13 10:09
河北移动“5G+绿色智慧矿山”助转型发展,12月7日，河北移动与九洲矿业、华为公司共同签署5G+绿色智慧矿山项目战略合作协议。此次三方合作的重点是实现基于5G技术的绿色智慧矿山创新应用。根据协议，基于九洲矿业井陉01号矿山项目应用场景，融合5G、人工智能、大数据、云计算等新一代信息技术，充分发挥各自的技术和资源优势，在5G+绿色智慧矿山领域,http://www.c114.com.cn/news/88/a1111469.html,2019/12/13 10:50
高通骁龙5G新平台 加速全球5G部署和普及,“2019年5G时代开启，全球超过40家运营商部署5G网络，超过40家终端厂商宣布推出5G终端；到2022年，全球5G智能手机累计出货量预计将超过14亿部；到2025年，全球5G连接数预计将达到28亿个。”在昨天举行的全新高通骁龙5G移动平台“芯”赏会上，高通全球副总裁侯明娟介绍，截至目前，全球搭载高通5G解决方案的终端设计已经超过230款。,http://www.c114.com.cn/news/51/a1111448.html,2019/12/13 09:27
唐山联通推动首钢5G智慧园区建设,近日，河北唐山联通与首钢京唐西山焦化有限公司签订5G智慧园区应用战略合作协议。双方为全面实施5G智慧园区信息化应用战略，以全业务经营、4G和5G为引擎，充分发挥各方在工业信息化中的综合治理、5G建设应用等领域的优势，建立战略合作伙伴关系，共同努力在资源共享、智联网平台、信息化建设服务、企业文化交流、,http://www.c114.com.cn/news/88/a1111474.html,2019/12/13 10:58
三星宣布转向RISC-V架构：5G毫米波射频IC明年商用,同样是开源指令集的RISC-V开始被越来越多公司接纳甚至采用，部分业内人士将其视为ARM的强有力对手。现在为RISC-V站台的巨头又多了一家，它就是三星。在10日于硅谷举办的RISC-V峰会上，三星公开资料称，RISC-V将率先用于其5G毫米波射频IC中。根据三星披露的信息，2017年，三星第一颗R,http://www.c114.com.cn/news/245/a1111480.html,2019/12/13 11:22
5G来了，华为云助力封面传媒迎接创新变革新挑战,"5G时代,随着云计算、人工智能等新兴技术的普及商用,媒体的接收终端正变得更多元、多场景,人们所想的万物皆媒将成为现实。在这样的背景下,传统媒体格局也将加速解构与重构,媒体融合则成为传统媒体转型升级为新兴媒体的选择。2016年,封面新闻APP正式上线。作为封面传媒旗下的旗舰产品,封面新闻APP同时承载",http://www.c114.com.cn/news/126/a1111398.html,2019/12/12 16:24
